q1	q2	Q1	Q2	Q3	Q4	Type		0: fully containment
http://qawiki.org/entity/Q611		Which horror movies were directed by siblings?	Which horror films were directed by brothers or sisters?	Which horror movies were directed by twin siblings?	Which horror movies were directed by non-twin siblings?	0		
http://qawiki.org/entity/Q328		What languages are pro-drop?	What languages drop pronouns?	Which pro-drop languages use Latin script?	Which pro-drop languages do not use Latin script?	0		
http://qawiki.org/entity/Q104		Which mountains are on Mars?	List all Martian mountains	Which Martian mountains are in the Tharsis Region?	Which Martian mountains are not in the Tharsis Region?	0		
http://qawiki.org/entity/Q336		Which mountains were first ascended in the last eighty years?	What mountains were first summited in the last 80 years?	Which mountains first ascended in the last eighty years are plutons?	Which mountains first ascended in the last eighty years are not plutons?	0		
http://qawiki.org/entity/Q259		Which movies are based on works written by Philip K. Dick?	What films adapt the writing of Philip K. Dick?	Which movies based on works written by Philip K. Dick feature androids?	Which movies based on works written by Philip K. Dick do not feature androids?	0		
http://qawiki.org/entity/Q200		Which movies directed by Chloé Zhao are not MPAA-rated R?	Which films not rated R did Chloe Zhao direct?	Which movies directed by Chloé Zhao are not MPAA-rated R and participated in Cannes?	Which movies directed by Chloé Zhao are not MPAA-rated R and did not participate in Cannes?	0		
http://qawiki.org/entity/Q421	http://qawiki.org/entity/Q202	Which movies star Uma Thurman?	In what films has Uma Thurman acted?	Which science fiction movies star Uma Thurman?	Which non-science fiction movies star Uma Thurman?	0		
http://qawiki.org/entity/Q206		Which movies were filmed in Yemen?	What films used locations in Yemen?	Which documentary movies were filmed in Yemen?	Which non-documentary movies were filmed in Yemen?	0		
http://qawiki.org/entity/Q414		Which musical groups formed the same year as Soda Stereo?	What musical groups started the same year that Soda Stereo started?	Which rock musical groups formed the same year as Soda Stereo?	Which non-rock musical groups formed the same year as Soda Stereo?	0		
		Which musicians are from Nordic Countries?	List Nordic musicians	Which Nordic musicians are from Sweden?	Which musicians are from Nordic countries excluding Sweden?	0		
http://qawiki.org/entity/Q553	http://qawiki.org/entity/Q554	Which natural languages are not Indo-European?	What human languages are not Indo-European?	Which official languages of the European Union are not Indo-European?	Which natural languages are not Indo-European and not official languages of the European Union?	0		
http://qawiki.org/entity/Q285		Which New Zealand cyclists participated in the 2000 Summer Olympics?	Which cyclists from New Zealand took part in the 2000 Olympics?	Which New Zealand cyclists taller than 180cm participated in the 2000 Summer Olympics?	Which New Zealand cyclists who are at most 180cm tall participated in the 2000 Summer Olympics?	0		
http://qawiki.org/entity/Q438		Which non-human animals have been sent into space?	What animals were launched into space?	Which non-human primates have been sent into space?	Which non-human animals have been sent into space excluding primates?	0		
http://qawiki.org/entity/Q445		Which online streamers studied at the University of Waterloo?	What online streamers were educated at the University of Waterloo?	Which online streamers who studied at the University of Waterloo live in Vancouver?	Which online streamers who studied at the University of Waterloo live outside Vancouver?	0		
http://qawiki.org/entity/Q619		Which paintings by Camille Pissarro were stolen?	What artworks by Camille Pissarro were subject to theft?	Which stolen paintings by Camille Pissarro were held at some point in Alte Nationalgalerie?	Which stolen paintings by Camille Pissarro were never held in Alte Nationalgalerie?	0		
http://qawiki.org/entity/Q275	http://qawiki.org/entity/Q607	Which parks are in Perth?	List parks in Perth	Which parks in Perth are State Registered Places?	Which parks in Perth are not State Registered Places?	0		
	http://qawiki.org/entity/Q182	Which people have an element named after them?	Which people who had a chemical element named in their honor?	Which people had an element named after them during their lifetime?	Which people had an element named after them posthumously?	1		
http://qawiki.org/entity/Q442		Which Pokémon are fire and bug types?	Which Pokémon are bug and fire types?	Which Generation VIII Pokémon are fire and bug types?	Which fire and bug type Pokémon are from generations other than Generation VIII?	0		
http://qawiki.org/entity/Q94		Which political parties was Abraham Lincoln a member of?	Abe Lincoln was a member of which political parties?	Which political parties that Abraham Lincoln was a member of still exist today?	Which political parties that Abraham Lincoln was a member of no longer exist?	0		
http://qawiki.org/entity/Q164		Which polygonal numbers less than 100 are also pronic?	What numbers less than 100 are both pronic and polygonal?	Which polygonal numbers less than or equals 40 are also pronic?	Which polygonal numbers greater than 40 but less than 100 are also pronic?	0		
http://qawiki.org/entity/Q312		Which popes were married?	Which popes had spouses?	Which popes were married before ordination?	Which popes were married after ordination but not before?	0		
http://qawiki.org/entity/Q203		Which relational database management systems are open source?	What open source relational database engines are there?	Which relational database management systems are open source and written in C or its variants?	Which relational database management systems are open source and written in a language other than C or its variants?	0		
http://qawiki.org/entity/Q423		Which rugby union teams have had Chilean players?	Which rugby union clubs have had players from Chile?	Which European rugby union teams have had Chilean players?	Which non-European rugby union teams have had Chilean players?	0		
http://qawiki.org/entity/Q543	http://qawiki.org/entity/Q544	Which saints died by crucifixion?	Which saints were crucified?	Who was the last saint to die by crucifixion?	Which saints died by crucifixion excluding the last one?	0		
http://qawiki.org/entity/Q542		Which saints have their feast day on Desmond Tutu's birthday?	What saints share their feast day with Desmond Tutu's birthday?	Which Catholic saints have their feast day on Desmond Tutu's birthday?	Which non-Catholic saints have their feast day on Desmond Tutu's birthday?	0		
http://qawiki.org/entity/Q540		Which saints have their feast day on June 15th?	What saints' feast day is on June 15?	Which saints with their feast day on June 15th are considered martyrs?	Which saints with their feast day on June 15th are not considered martyrs?	0		
http://qawiki.org/entity/Q615		Which sauces are named after Italian cities?	What sauces are named after cities in Italy?	Which Italian sauces are named after Italian cities?	Which sauces named after Italian cities are not Italian?	0		
http://qawiki.org/entity/Q265		Which sauces contain onion and garlic?	What sauces have garlic and onion?	Which Italian sauces contain both onion and garlic?	Which non-Italian sauces contain both onion and garlic?	0		
http://qawiki.org/entity/Q202		Which science fiction movies star Uma Thurman?	In what sci fi films has Uma Thurman acted?	Which 1990s science fiction movies star Uma Thurman?	Which science fiction movies starring Uma Thurman were released outside of the 1990s?	0		
		Which series or movies were directed by alumni of the University of Bergen?	Which films or TV series were directed by University of Bergen alumni?	Which documentary series or movies were directed by alumni of the University of Bergen?	Which non-documentary series or movies were directed by alumni of the University of Bergen?	0		
http://qawiki.org/entity/Q139		Which Simpsons characters were not born in Springfield?	Which Simpsons characters were born outside Springfield?	Which female Simpsons characters were not born in Springfield?	Which Simpsons characters were not born in Springfield excluding female characters?	0		
http://qawiki.org/entity/Q613		Which smartphones are made by Chinese companies headquartered in Dongguan?	What smartphones are manufactured by Chinese companies with headquarters in Dongguan?	Which smartphones made by Chinese companies headquartered in Dongguan use ColorOS?	Which smartphones are made by Chinese companies headquartered in Dongguan do not use ColorOS?	0		
http://qawiki.org/entity/Q602	http://qawiki.org/entity/Q123	Which species are endemic to Chile?	What species are only found in Chile?	Which species endemic to Chile are endangered?	Which species endemic to Chile are not endangered?	0		
http://qawiki.org/entity/Q570	http://qawiki.org/entity/Q118	Which telescopes are based in Chile or countries that border Chile?	Which telescopes are based in Chile or in countries that neighbor Chile?	Which telescopes are based in Chile?	Which telescopes are based in countries that border Chile?	0		
http://qawiki.org/entity/Q118		Which telescopes are based in Chile?	What telescopes are located in Chile?	Which optical telescopes are based in Chile?	Which non-optical telescopes are based in Chile?	0		
		Which Turing Award winners were born in Europe?	Who born in Europe has won a Turing Award?	Which European Turing Award winners were born in Ireland or the U.K.?	Which European Turing Award winners were not born in Ireland or the U.K.?	0		
http://qawiki.org/entity/Q155	http://qawiki.org/entity/Q599	Which universities are based in Peru?	What universities are in Peru?	Which universities based in Peru have been established since 1950?	Which universities based in Peru were established before 1950?	0		
http://qawiki.org/entity/Q599		Which universities based in Peru were established since 1950?	What universities in Peru were founded since 1950?	Which public universities in Peru have been established since 1950?	Which non-public universities in Peru have been established since 1950?	0		
http://qawiki.org/entity/Q114		Which video games are known to be NP-complete?	What video games are NP-complete?	Which puzzle video games are known to be NP-complete?	Which video games are known to be NP-complete aside from puzzle games?	0		
http://qawiki.org/entity/Q106		Which video games have a fox character?	What video games have a character that is a fox?	Which video games published by Nintendo have a fox character?	Which video games have a fox character excluding those published by Nintendo?	0		
http://qawiki.org/entity/Q416		Which video games have won the award of Best Esports Game of the Year at The Game Awards?	Which games have been awarded the Best Esports Game of the Year?	Which video games that have won the award of Best Esports Game of the Year at The Game Awards have a sequel?	Which video games that have won the award of Best Esports Game of the Year at The Game Awards do not have a sequel?	0		
		Which wars took place in South America?	What wars happened in South America?	Which civil wars took place in South America?	Which international wars took place in South America?	0		
http://qawiki.org/entity/Q177		Which writers speak French, Arabic and Japanese?	Which authors speak French, Arabic and Japanese?	Which writers speak English, French, Arabic and Japanese?	Which writers speak French, Arabic, and English but do not speak Japanese?	0		
http://qawiki.org/entity/Q614		Which YouTube channels with more than 500,000 subscribers talk about math?	List YouTube maths channels with more than 500,000 followers	Which English-language YouTube channels with more than 500,000 subscribers talk about math?	Which YouTube channels with more than 500,000 subscribers talk about math in languages other than English?	0		
http://qawiki.org/entity/Q452		Who are Elon Musk's ex-spouses?	Who are Elon Musk's past spouses?	Which of Elon Musk's ex-spouses were married to him multiple times?	Which of Elon Musk's ex-spouses were married to him only once?	0		
http://qawiki.org/entity/Q462	http://qawiki.org/entity/Q461	Who are the editors of EMMA?	Who are EMMA's editors?	Who are the editors-in-chief of EMMA?	Who are the editors of EMMA excluding the editors-in-chief?	0		
http://qawiki.org/entity/Q461		Who are the editors-in-chief of EMMA?	Who are EMMA's editors-in-chief?	Who have been editors-in-chief of the EMMA journal since 2024?	Who are the former editors-in-chief of EMMA before 2024?	0		
		Who are the original developers of SPSS?	Who are SPSS' initial developers?	Which of the original developers of SPSS were educated in Mexico?	Which of the original developers of SPSS were not educated in Mexico?	0		
http://qawiki.org/entity/Q372		Who has run against Jair Bolsonaro for President of Brazil?	Who ran against Bolsonaro for Brazilian President?	Who ran against Jair Bolsonaro for President of Brazil the first time he ran?	Who ran against Jair Bolsonaro for President of Brazil beyond his first run?	0		
		Who has served as Prime Minister of South Korea in the past 20 years?	Name all South Korean Prime Ministers from the past 20 years	Who is the prime minister of South Korea?	Who has served as Prime Minister of South Korea in the past 20 years excluding the current one?	0		
http://qawiki.org/entity/Q168		Who has won more than one type of Nobel Prize?	Who has won multiple types of Nobel Prize?	Who has won the Nobel Peace Prize and another type of Nobel Prize?	Who has won more than one type of Nobel Prize excluding the Nobel Peace Prize?	0		
		Who were the candidates in the 1972 United States Presidential Election?	Who ran in the 1972 U.S. Presidential Election?	Who was the Democratic party candidate in the 1972 United States Presidential Election?	Who were the candidates in the 1972 United States Presidential Election excluding any Democrats?	0		