q1	q2	Q1	Q2	Q3	Q4	Type		0: fully containment
http://qawiki.org/entity/Q392		In which countries are tepuis found?	In which countries are tepuis located?	In which Spanish-speaking countries are tepuis found?	In which countries that are not Spanish-speaking are tepuis found?	0		1: semantic containment
http://qawiki.org/entity/Q620	http://qawiki.org/entity/Q621	In which countries is Elon Musk a citizen?	What citizenships does Elon Musk hold?	In which countries is Elon Musk a naturalized citizen?	In which countries is Elon Musk a citizen but not through naturalization?	0		2: too subjective or ambiguous
http://qawiki.org/entity/Q473	http://qawiki.org/entity/Q474	In which journals has Amrapali Zaveri published?	In what journals has Amrapali Zaveri published?	In which journals has Amrapali Zaveri published as first author?	In which journals has Amrapali Zaveri published but not as first author?	0		
http://qawiki.org/entity/Q102		In which movies did Al Pacino and Robert de Niro appear together?	In which films do Pacino and de Niro costar?	In which movies directed by Scorsese did Al Pacino and Robert de Niro appear together?	In which movies not directed by Scorsese did Al Pacino and Robert de Niro appear together?	0		
http://qawiki.org/entity/Q101		In which museums can I see paintings by El Greco?	Which museums display artworks by El Greco?	In which national museums can I see paintings by El Greco?	In which non-national museums can I see paintings by El Greco?	0		
http://qawiki.org/entity/Q197		Kim Deal played with which bands?	With which music groups did Kim Deal play?	Kim Deal played in which bands without Black Francis?	Kim Deal played with Black Francis in which bands?	0		
		List astronauts who completed degrees at MIT.	Which astronauts completed degrees with the Massachusetts Institute of Technology?	List astronauts who completed undergraduate degrees at MIT.	List astronauts who completed graduate degrees at MIT.	0		
		List the richest 10 persons in the world	Who are the ten richest people globally?	Who is the richest person in the world?	List the second to tenth richest persons in the world.	1		
		List the top 10 largest countries in Africa by area.	What are the ten most expansive African countries?	What is the largest country in Africa by area?	List the second to tenth largest countries in Africa by area.	0		
	http://qawiki.org/entity/Q17	List the top ten largest countries in Africa by population.	What are the ten most populous African countries?	What is the largest country in Africa by population?	List the second to tenth largest countries in Africa by population.	0		
http://qawiki.org/entity/Q590	http://qawiki.org/entity/Q589	Which countries are part of the G20?	Who is in the G20?	Which countries are part of the G20?	What members of the G20 are not countries?	1		
http://qawiki.org/entity/Q551	http://qawiki.org/entity/Q554	What are the official languages of the European Union?	What are the official languages of the EU?	Which official languages of the European Union are not Indo-European?	Which official languages of the European Union are Indo-European?	0		
http://qawiki.org/entity/Q342		What are the subsidiaries of Meta Platforms?	What subsidiaries does Meta have?	What subsidiaries of Meta Platforms contain "Facebook" in their name?	What subsidiaries of Meta Platforms do not contain "Facebook" in their name?	0		
		What are the ten tallest mountains in the world?	List the 10 highest mountains globally	Among the ten tallest mountains in the world, which ones span international borders?	Among the ten tallest mountains in the world, which ones are entirely contained in one country?	0		
http://qawiki.org/entity/Q618		What binary neutron stars are in the constellation Scorpius?	What binary neutron stars are found in Scorpius?	What binary neutron stars in the constellation Scorpius have exoplanets orbiting them?	What binary neutron stars in the constellation Scorpius do not have exoplanets orbiting them?	0		
http://qawiki.org/entity/Q111		What buildings are named after JFK?	What buildings are named after John F. Kennedy?	What educational buildings are named after JFK?	What buildings other than educational ones are named after JFK?	0		
http://qawiki.org/entity/Q136		What chocolate bars are made by Nestlé?	Which chocolate candy bars do Nestle manufacture?	What chocolate bars are made by Nestlé and contain nuts?	What chocolate bars are made by Nestlé and don't contain nuts?	0		
http://qawiki.org/entity/Q302		What cities are twinned with Port-au-Prince?	With which cities is Port-au-Prince twinned?	Which North American cities are twinned with Port-au-Prince?	Which cities outside North America are twinned with Port-au-Prince?	0		
http://qawiki.org/entity/Q390		What collections outside of Africa exhibit Benin Bronzes?	Which locations not in Africa show Benin Bronzes?	What national museums outside of Africa exhibit Benin Bronzes?	What collections outside of Africa that are not national museums exhibit Benin Bronzes?	0		
http://qawiki.org/entity/Q245		What colors are in the French flag?	What are the colours of the flag of France?	What colors are in both the French flag and the Italian flag?	What colors are in the French flag but not the Italian flag?	0		
		What countries are in Europe?	List all European countries	What countries are in the Schengen area?	Which European countries are not part of the Schengen area?	0		
		What countries are in the EU?	List all European Union countries	What countries are EU Founding Members?	What countries are in the EU but are not founding members?	0		
http://qawiki.org/entity/Q349	http://qawiki.org/entity/Q566	What countries border Ghana?	What countries are neighbors of Ghana?	What countries that border Ghana have a higher population than Ghana?	What countries that border Ghana have a lower or equal population compared with Ghana?	0		
http://qawiki.org/entity/Q194		What diseases are associated with the gene FGF14?	What diseases relate to FGF14?	What diseases affecting pregnancy are associated with the gene FGF14?	What diseases, excluding those affecting pregnancy, are associated with the gene FGF14?	0		
http://qawiki.org/entity/Q318		What documentaries are about whaling?	List whaling documentaries	What documentaries released on or after 2010 are about whaling?	What documentaries released before 2010 are about whaling?	0		
http://qawiki.org/entity/Q277		What drinks are from Africa?	List African drinks	What alcoholic drinks are from Africa?	What non-alcoholic drinks are from Africa?	0		
http://qawiki.org/entity/Q480		What elementary particles interact with the strong force and the weak force?	What elementary particles interact with the weak force and the strong force?	Which elementary particles with negative charge interact with both the strong and weak forces?	Which elementary particles with neutral or positive charge interact with both the strong and weak forces?	0		
http://qawiki.org/entity/Q476	http://qawiki.org/entity/Q480	What elementary particles interact with the weak force?	Which fundamental particles are mediated by the weak interaction?	What elementary particles interact with the strong force and the weak force?	What elementary particles interact with the weak force but not the strong force?	0		
		What movies were directed by Mira Nair?	What films were directed by Mira Nair?	What primarily Hindi-language movies were directed by Mira Nair?	What movies directed by Mira Nair are not primarily in the Hindi language?	0		
http://qawiki.org/entity/Q396		What hybrid species can have offspring?	Which hybrid species are fertile?	What mammal hybrid species can have offspring?	What non-mammal hybrid species can have offspring?	0		
http://qawiki.org/entity/Q385		What languages did Kofi Annan speak?	What languages did Kofi Annan know?	What languages indigenous to Ghana did Kofi Annan speak?	What languages not indigenous to Ghana did Kofi Annan speak?	0		
http://qawiki.org/entity/Q490		What montes form the Tharsis Montes?	List the Tharsis Montes	Which montes form Tharsis Montes are taller than 10000 metres?	Which montes in the Tharsis Montes are not taller than 1000 metres?	0		
http://qawiki.org/entity/Q341		What movies are in the Matrix series?	List Matrix movies	In which movies of the Matrix series does Bane appear?	In which movies of the Matrix series does Bane not appear?	0		
http://qawiki.org/entity/Q239		What museums are in Addis Ababa?	What museums are located in Addis Ababa?	What art museums are in Addis Ababa?	What museums in Addis Ababa are not art museums?	0		
http://qawiki.org/entity/Q584	http://qawiki.org/entity/Q585	What novels were written by Harper Lee?	What novels are by Harper Lee?	What novels written by Harper Lee were adapted into movies?	What novels written by Harper Lee were not adapted into movies?	0		
		What officially recognized dwarf planets orbit the Sun?	What dwarf planets are confirmed to orbit the Sun?	What officially recognized dwarf planets orbit the Sun and have a moon?	What officially recognized dwarf planets orbit the Sun but do not have a moon?	1		
http://qawiki.org/entity/Q444		What Ogham stones can be found in County Clare?	What Ogham stones does Co. Clare have?	What 5th-century Ogham stones are located in County Clare?	What Ogham stones found in County Clare are not from the 5th century?	0		
http://qawiki.org/entity/Q391		What operas are based on works by Alexander Pushkin?	What operas are based on works by Pushkin?	What operas based on works by Alexander Pushkin debuted in the Mariinsky Theatre?	What operas based on works by Alexander Pushkin debuted in a place other than the Mariinsky Theatre?	0		
http://qawiki.org/entity/Q549	http://qawiki.org/entity/Q550	What other buildings have the same architect as the Tsentrosoyuz Building?	What other buildings were by the same architect as the Tsentrosoyuz Building?	What other buildings that are not functionalist have the same architect as the Tsentrosoyuz Building?	What other funcionalist buildings have the same architect as the Tsentrosoyuz Building?	0		
http://qawiki.org/entity/Q264	http://qawiki.org/entity/Q475	What papers did Amrapali Zaveri publish?	What papers has Amrapali Zaveri published?	What papers did Amrapali Zaveri publish as first author?	What papers did Amrapali Zaveri write but not as first author?	0		
http://qawiki.org/entity/Q313		What poets were Holocaust victims?	Which Holocaust victims were poets?	What Polish poets were Holocaust victims?	What non-Polish poets were Holocaust victims?	0		
http://qawiki.org/entity/Q307		What proteins are found in dendrites?	Dendrites contain what proteins?	What membrane proteins are found in dendrites of neurons?	What non-membrane proteins are found in dendrites of neurons?	0		
http://qawiki.org/entity/Q315		What proteins are involved in retina homeostasis?	Which proteins play a role in retina homeostasis?	What membrane proteins are involved in retina homeostasis?	What non-membrane proteins are involved in retina homeostasis?	0		
http://qawiki.org/entity/Q337		What radio stations broadcast specifically in Boston?	List radio stations broadcasting only in Boston	What university-owned radio stations broadcast specifically in Boston?	What radio stations broadcast specifically in Boston but are not owned by universities?	0		
http://qawiki.org/entity/Q346		What religions promote vegetarianism?	What religions restrict eating meat?	What religions require vegetarianism under all circumstances?	What religions promote vegetarianism but do not require it under all circumstances?	0		
http://qawiki.org/entity/Q354	http://qawiki.org/entity/Q355	What species are in the order Monotremata?	What species are monotremes?	What extant species are in the order Monotremata?	What extinct species are in the order Monotremata?	0		
		What species are in the same family as Homo sapiens?	What species share the family of Homo sapiens?	What extant species are in the same family as Homo sapiens?	What extinct species are in the same family as Homo sapiens?	0		
http://qawiki.org/entity/Q359		What species are in the same genus as the monkeypox virus?	What viruses share the same genus as monkeypox?	What species in the same genus as the monkeypox virus have had cases of human infection?	What species in the same genus as the monkeypox virus have not had cases of human infection?	0		
http://qawiki.org/entity/Q309		What team sports use sticks?	In which sports do teams use sticks?	Which winter team sports use sticks? 	Which team sports use sticks excluding winter sports?	0		
http://qawiki.org/entity/Q176		What video games are made by the developer of League of Legends?	What video games did the developers of League of Legends develop?	Which video games produced by the League of Legends developer were released in 2020 or later?	Which video games produced by the League of Legends developer were released before 2020?	0		
		What volcanoes in Iceland are currently active?	List Icelandic active volcanos	What volcanos in Iceland are currently active and taller than 1000 metres?	What volcanos in Iceland are currently active and not taller than 1000 metres?	0		
		What weapons were used in mass shootings in the United States?	List weapons used in American shootings sprees	What semi-automatic weapons were used in mass shootings in the United States?	What non-semi-automatic weapons were used in mass shootings in the United States?	0		
http://qawiki.org/entity/Q179		What whisky distilleries are based in Ireland?	Give me all whiskey distilleries in Ireland	What whisky distilleries are based in Cork, Ireland?	What whisky distilleries are based in Ireland outside of Cork?	0		
http://qawiki.org/entity/Q616	http://qawiki.org/entity/Q283	Where has Tim Berners-Lee worked?	Where has Tim Berners-Lee been employed?	Where does Tim Berners-Lee currently work?	Where has Tim Berners-Lee worked in the past?	0		
http://qawiki.org/entity/Q207		Which actors are Scientologists?	What actors are followers of Scientology?	Which actors who are Scientologists have a star on the Hollywood Walk of Fame?	Which actors who are Scientologists do not have a star on the Hollywood Walk of Fame?	0		
http://qawiki.org/entity/Q472		Which Asian universities have female rectors?	What universities in Asia have female rectors?	Which Asian universities with female rectors receive public funds?	Which Asian universities with female rectors do not receive public funds?	0		
http://qawiki.org/entity/Q415		Which association football players have at least two citizenships?	Which football players have more than one nationality?	Which association football players have at least three citizenships?	Which association football players have exactly two citizenships?	0		
http://qawiki.org/entity/Q547	http://qawiki.org/entity/Q546	Which buildings are brutalist?	Which buildings exemplify brutalism?	Which buildings combine functionalism and brutalism?	Which brutalist buildings do not incorporate functionalism?	0		
http://qawiki.org/entity/Q548	http://qawiki.org/entity/Q546	Which buildings are funcionalist?	Which buildings exemplify functionalism?	Which buildings combine functionalism and brutalism?	Which functionalist buildings are not brutalist?	0		
http://qawiki.org/entity/Q575	http://qawiki.org/entity/Q576	Which carbon isotopes can decay into boron isotopes?	What isotopes of carbon can decay into isotopes of boron?	Which carbon isotopes can decay into boron isotopes via electron capture?	Which carbon isotopes can decay into boron isotopes but not by electron capture?	0		
http://qawiki.org/entity/Q577	http://qawiki.org/entity/Q575	Which carbon isotopes can recursively decay into boron isotopes?	What isotopes of carbon can recursively decay into isotopes of boron?	Which carbon isotopes can directly decay into boron isotopes?	Which carbon isotopes can recursively but not directly decay into boron isotopes?	1		
http://qawiki.org/entity/Q362		Which chess openings are variations of the Sicilian Defence?	What openings can follow from a Sicilian?	Which chess openings that are variations of the Sicilian Defence involve the move cxd4?	Which chess openings that are variations of the Sicilian Defence do not involve the move cxd4?	0		
http://qawiki.org/entity/Q183		Which Chilean companies have U.S. parent companies?	What Chilean companies have American parent companies?	Which Chilean energy companies have U.S. parent companies?	Which Chilean companies, excluding energy companies, have U.S. parent companies?	0		
http://qawiki.org/entity/Q135		Which cities are named after an apostle?	What cities are named in honor of an apostle?	Which cities named after an apostle have a population of at least one million?	Which cities named after an apostle have a population of less than one million?	0		
http://qawiki.org/entity/Q482	http://qawiki.org/entity/Q483	Which civil wars started in the nineteenth century?	What civil wars began in the 19th century?	Which civil wars started in South America in the nineteenth century?	Which civil wars started in the nineteenth century outside of South America?	0		
http://qawiki.org/entity/Q481	http://qawiki.org/entity/Q483	Which civil wars took place in South America?	What civil wars happened in South America?	Which civil wars started in South America in the nineteenth century?	Which civil wars took place in South America but did not start in the 19th century?	0		
		Which clubs did Lionel Messi play for?	With which clubs did Lionel Messi play?	Which European clubs did Lionel Messi play for?	Which clubs outside of Europe did Lionel Messi play for?	0		
http://qawiki.org/entity/Q160		Which colors are named after fruits?	Which colors take their name from fruits?	What colors are named after exotic fruits?	What colors are named after fruits that are not exotic fruits?	0		
http://qawiki.org/entity/Q133		Which conferences focus on Machine Learning?	List machine learning conferences	Which conferences that focus on Machine Learning were formed more than 40 years ago?	Which conferences that focus on Machine Learning were formed in the last 40 years?	0		
http://qawiki.org/entity/Q175		Which conferences were organized by Turing Award winners?	What conferences had a Turing Award winner organizing them?	Which conferences have been organized by Turing Award winners since 2016?	Which conferences were organized by Turing Award winners before 2016?	0		
http://qawiki.org/entity/Q154		Which countries are governed by a monarchy?	Which countries have a monarchy?	Which countries are governed by a constitutional monarchy?	Which countries are governed by a monarchy without a constituion?	0		
		Which countries are in Latin America?	List Latin American countries	What are the Spanish-speaking Latin American countries?	What are the non-Spanish-speaking Latin American countries?	0		
http://qawiki.org/entity/Q512		Which countries are in the Balkan region?	What are Balkan countries?	Which European Union countries are in the Balkan region?	Which non-European Union countries are in the Balkan region?	0		
http://qawiki.org/entity/Q117		Which countries are named after plants?	Which countries' names are taken from plants?	Which island countries are named after plants?	Which mainland countries are named after plants?	0		
http://qawiki.org/entity/Q589	http://qawiki.org/entity/Q593	Which countries are part of the G20?	Which nations are in the G20?	Which countries are part of the G20 and the Arab League?	Which countries are part of the G20 but not the Arab League?	0		
http://qawiki.org/entity/Q222		Which countries border South Sudan?	Which countries does South Sudan border?	What country that borders South Sudan borders the most countries?	What countries border South Sudan excluding that which borders the most countries?	0		
http://qawiki.org/entity/Q287		Which countries changed their driving side from left to right?	Which countries changed from driving on the left to driving on the right?	Which countries changed their driving side from left to right due to being occupied or annexed?	Which countries changed their driving side from left to right but not due to being occupied or annexed?	0		
http://qawiki.org/entity/Q113		Which countries currently have multiple capitals?	Which countries have more than one capital city today?	Which extant countries with multiple capitals are recognized by all of their neighbours?	Which extant countries with multiple capitals are not recognized by all of their neighbours?	0		
http://qawiki.org/entity/Q173		Which countries drive on the left?	In which countries does traffic drive on the left?	Which countries drive on the left in Europe?	Which countries drive on the left outside of Europe?	0		
http://qawiki.org/entity/Q153	http://qawiki.org/entity/Q597	Which countries have a female head of state?	What countries have a woman as head of state?	Which Asian countries have a female head of state?	Which non-Asian countries have a female head of state?	0		
http://qawiki.org/entity/Q407		Which countries have diplomatic relations with Chile?	Which countries does Chile have diplomatic relations with?	Which European countries have diplomatic relations with Chile?	Which non-European countries have diplomatic relations with Chile?	1		
http://qawiki.org/entity/Q233		Which countries have Islam as an official religion?	In which countries is Islam an official religion?	Which countries in Asia have Islam as an official religion?	Which countries outside of Asia have Islam as an official religion?	0		
http://qawiki.org/entity/Q74		Which countries have won a Cricket World Cup?	Which countries have won a World Cup in Cricket?	Which countries in Asia have won a Cricket World Cup?	Which countries outside of Asia have won a Cricket World Cup?	0		
http://qawiki.org/entity/Q72		Which countries have won a FIFA World Cup?	List all countries that won a FIFA World Cup	Which countries in Europe have won a FIFA World Cup?	Which non-European countries have won a FIFA World Cup?	0		
http://qawiki.org/entity/Q81		Which countries have won a Rugby World Cup?	Give me all countries that have won a Rugby World Cup	Which primarily southern-hemisphere countries have won a Rugby World Cup?	Which primarily northern-hemisphere countries have won a Rugby World Cup?	0		
http://qawiki.org/entity/Q227		Which countries observe Victory in Europe day?	In which countries is VE day commemorated?	Which countries in the EU observe Victory in Europe day?	Which countries outside of the EU observe Victory in Europe Day?	0		
http://qawiki.org/entity/Q167		Which countries use the same plug as Canada?	What countries have the same power outlets as Canada?	Which countries use the same plug as Canada and share an official language with Canada?	Which countries use the same plug as Canada but do not share an official language with Canada?	0		
http://qawiki.org/entity/Q204		Which countries were dissolved in the 1990s?	What countries ended in the 90s?	Which European countries were dissolved in the 1990s?	Which non-European countries were dissolved in the 1990s?	0		
http://qawiki.org/entity/Q159		Which culinary nuts are not botanical nuts?	What culinary nuts are not botanical?	Which culinary nuts are not botanical nuts nor drupes?	Which culinary nuts are drupes but not botanical nuts?	0		
http://qawiki.org/entity/Q454		Which death row prisoners had pizza as their last meal?	Which executed inmates had pizza for their last meal?	Which death row prisoners executed by hanging had pizza as their last meal?	Which death row prisoners executed by a method other than hanging had pizza as their last meal?	0		
http://qawiki.org/entity/Q257		Which desserts contain cinnamon?	What desserts use cinnamon?	Which American desserts contain cinnamon?	Which non-American desserts contain cinnamon?	0		
http://qawiki.org/entity/Q208		Which dog breeds originated in China?	What canine breeds come from China?	Which toy dog breeds originated in China? 	Which non-toy dog breeds originated in China?	0		
http://qawiki.org/entity/Q537		Which drugs for treating atrial fibrillation are contraindicated in patients taking lovastatin?	Which medications for treating atrial fibrillation are contraindicated in people who take lovastatin?	Which antiarrhythmic drugs for atrial fibrillation are contraindicated in patients taking lovastatin?	Which non-antiarrhythmic drugs for atrial fibrillation are contraindicated in patients taking lovastatin?	0		
http://qawiki.org/entity/Q465		Which Ethiopian political parties were founded since 2000?	Which Ethiopian political parties started since 2000?	Which Ethiopian political parties founded since 2000 are still active?	Which Ethiopian political parties founded since 2000 are no longer active?	0		
http://qawiki.org/entity/Q564		Which football midfielders born in Senegal have played for France?	Which French midfielders were born in Senegal?	Which football midfielders born in Senegal have played for France and Inter Milan?	Which football midfielders born in Senegal have played for France excluding those who played for Inter Milan?	0		
http://qawiki.org/entity/Q563	http://qawiki.org/entity/Q565	Which football players born in Senegal have played for France?	Which French footballers were born in Senegal?	Which football midfielders born in Senegal have played for France?	Which football players born in Senegal have played for France excluding midfielders?	0		
		Which heads of state died from COVID-19 complications?	Which heads of state passed away due to COVID-19?	Which heads of state died in office from COVID-19 complications?	Which heads of state died from COVID-19 complications but not while in office?	0		
http://qawiki.org/entity/Q163		Which honorary mayors were not human?	List honorary mayors who were not people	Which honorary mayors in Alaska were not human?	Which honorary mayors outside Alaska were not human?	0		
