Q1	Q2	Q3	Q4
List the screenwriters and story-writers for the film 'The Dark Knight'.	Who wrote the screenplay or story for 'The Dark Knight'?	List the screenwriters for the film 'The Dark Knight' who also wrote the story.	List writers of 'The Dark Knight' who wrote either the screenplay or the story, but not both.
What are the neighboring countries of the People's Republic of China, both past and present, that have fought against China in a war?	Which countries (both current and historical) bordering China have fought a war against China?	Which current countries bordering China have fought a war against China?	Which historical countries bordering China have fought a war against China?
List the recipients of the Nobel Prize in Physics who did not share their award.	Who has won the Nobel Prize in Physics alone?	List the recipients of the Nobel Prize in Physics who did not share their award and were the first person from their country to win the award.	List the recipients of the Nobel Prize in Physics who did not share their award but were not the first person from their country to win the award.
List the actresses who starred in the original Star Trek television show and played crew members of the USS Enterprise.	Who were the actresses of Star Trek: The Original Series and played crew of the USS Enterprise?	List the actresses who starred in the original Star Trek television show and played crew members of the USS Enterprise in multiple seasons.	List the actresses who starred in the original Star Trek television show and played crew members of the USS Enterprise in only one season.
List the subsidiaries of The Walt Disney Company that it wholly owns or has a controlling interest in.	What companies does The Walt Disney Company own or have a controlling interest in?	What companies does The Walt Disney Company wholly own?	In what companies does The Walt Disney Company hold a controlling interest without wholly owning it?
List the Oscar-winning cast members of the film Inception.	What actors in Inception have won an Academy Award?	List the actors of Inception who have won an Oscar, but not for Inception.	List the actors who won an Oscar for Inception.
List the accolades received by Bob Dylan.	What awards has Bob Dylan won?	List the Grammy Awards received by Bob Dylan.	List the accolades received by Bob Dylan excluding the Grammy Awards.
List the composers of 'Avatar: The Last Airbender'.	Who composed music for the series 'Avatar: The Last Airbender'?	List the composers of 'Avatar: The Last Airbender' who were educated at the Berklee College of Music.	List the composers of 'Avatar: The Last Airbender' who were not educated at the Berklee College of Music.
What modern countries were part of the Soviet Union?	Which extant countries were in the Soviet Union?	What modern countries were part of the Soviet Union and border Russia?	What modern countries were part of the Soviet Union but do not border Russia?
Which flags of the regions of Italy feature at least two of the three colors of the national flag?	What regional flags of Italy use at least two of the three colors of the flag of Italy?	Which flags of the regions of Italy share exactly two colors with the national flag?	Which flags of the regions of Italy share exactly three colors with the national flag?
List the wholly-owned subsidiaries of Amazon founded outside the U.S.	What companies founded outside the United States does Amazon wholly own?	List the wholly-owned subsidiaries of Amazon founded in Israel.	List the wholly-owned subsidiaries of Amazon founded outside the U.S. and Israel.
List the directors who worked on the Breaking Bad series.	Who directed episodes of Breaking Bad?	List the directors who worked on the Breaking Bad series and directed more than one episode.	List the directors who worked on the Breaking Bad series but directed only one episode.
List the German federal states.	What are the federal states of Germany?	List the German federal states located (partially or wholly) in the former East Germany.	List the German federal states located entirely in the former West Germany.
List the founding member states of the AU.	Which countries founded the African Union?	List the founding member states of the AU who were later suspended.	List the founding member states of the AU who were never suspended.
List the musicians who played in Nirvana.	Who were the members of the band Nirvana?	List the musicians who played in Nirvana during the original lineup.	List the musicians who played in Nirvana excluding those from the original lineup.
List the US presidents who belonged to the Democratic Party.	Which US presidents were members of the Democratic Party?	List the US presidents who belonged to the Democratic Party and served multiple terms.	List the US presidents who belonged to the Democratic Party and served at most one term.
List the Indian states with an official language that is Dravidian.	What are the states of India with an official language that is Dravidian?	List the most populous Indian state with an official language that is Dravidian.	List the Indian states with an official language that is Dravidian excluding the most populous such state.
List the US presidents who belonged to the Republican Party.	Which US presidents were members of the Republican Party?	List the US presidents who belonged to the Republican Party and served during the 20th century.	List the US presidents who belonged to the Republican Party excluding those who served during the 20th century.
Which capitals of African countries were founded in the 1800s?	List capitals of African countries founded in the 19th century.	Which capitals of African countries were founded between 1800 and 1849, inclusive?	Which capitals of African countries were founded between 1850 and 1899, inclusive?
Which mountains have a peak above 8,000 meters?	What are the mountains higher than 8,000 meters?	Which mountains have a peak above 8,000 meters located in the Himalayas?	Which mountains have a peak above 8,000 meters excluding those located in the Himalayas?
Who have been the kings of Belgium?	List all Belgian kings.	List all past Belgian kings.	Name the current Belgian king.
Which different kinds of triangles exist according to their angles?	What are the types of triangles divided by angles?	Which types of triangles can have an angle of over 90 degrees?	Which types of triangles cannot have an angle of over 90 degrees?
Which languages have been made official in South Africa since 1990?	What languages of South Africa have been made official since 1990?	Which sign languages have been made official in South Africa since 1990?	Which spoken languages have been made official in South Africa since 1990?
Which holidays are recognized as federal holidays in the United States?	What are the U.S. federal holidays?	Which federal holidays in the United States involve the celebration of historical or religious events?	Which federal holidays in the United States are not related to the celebration of historical or religious events?
Which languages have official status in some autonomous communities of Spain?	What languages are official in some Spanish autonomous community?	What languages are official in some Spanish autonomous community but not nationally?	What languages are official in some Spanish autonomous community and nationally?
What countries have more than 100 million inhabitants?	Which countries have a population over 100 million?	What countries have more than 100 million inhabitants and are located in Asia?	What countries have more than 100 million inhabitants and are not located in Asia?
What are the Ancient Wonders of the World?	What are the Seven Ancient Wonders of the World?	What is the oldest of the Seven Ancient Wonders of the World?	What are the Seven Ancient Wonders of the World excluding the oldest?
What countries officially use Arabic but are not on the Arabian peninsula?	Which countries not in the Arabian Peninsula do not have Arabic as an official language?	What countries officially use Arabic but are not on the Arabian peninsula nor in Africa?	What countries officially use Arabic and are not on the Arabian peninsula but are rather in Africa?
What countries recognize a sign language as an official language?	In which countries is a sign language recognized as official?	What countries recognize a sign language as an official language in their constitution?	What countries recognize a sign language as an official language but not constitutionally?
Which rock classifications are recognized in geology?	What are the types of rocks?	To which rock classification does marble belong?	What are the rock classifications excluding the one to which marble belongs?
What extant countries used to be part (wholly or partially) of the Roman empire?	Which modern countries have regions that used to be part of the Roman empire?	Which modern countries have regions that used to be part of the Roman empire and have a Romance language as an official language?	Which modern countries have regions that used to be part of the Roman empire but do not have a Romance language as an official language?
Which Indian states are more populous than France?	What states in India have more inhabitants than France?	Which Indian states have more than twice the population of France?	Which Indian states have a larger population than France but not more than twice its population?
What are the notes in a C7 chord?	Which notes comprise a C dominant 7th chord?	What are the notes in both a C7 chord and a C minor chord?	What are the notes in a C7 chord but not a C minor chord?
What fire Pokemon were introduced in Generation 5?	Which Pokemon of type fire were first seen in Gen 5?	What multi-type Pokemon were introduced in Generation 5 where one type is fire?	What exclusively fire Pokemon were introduced in Generation 5?
What are the chambers of the human heart?	What chambers are in the human heart?	What chambers are on the right side of the human heart?	What chambers are on the left side of the human heart?
Which chemical elements have a lower boiling point than water?	The boiling point of which chemical elements is lower than that of water?	The boiling point of which chemical elements is lower than that of water but higher than 25°C?	The boiling point of which chemical elements is lower than that of water and lower than or equal to 25°C?
Which numbers below 100 are prime?	What are the prime numbers less than 100?	Which numbers below 100 are prime and even?	Which numbers below 100 are prime and odd?
Which U.S. Presidents were assassinated while in office?	Which sitting American Presidents were killed?	Which U.S. Presidents were assassinated while in office and served less than a year?	Which U.S. Presidents were assassinated while in office and served at least a year?
What notes do the open strings on a guitar play under standard tuning?	What notes do the open strings on a guitar play under standard tuning?	What notes are played by multiple open strings on a guitar under standard tuning?	What notes are played by only one open string on a guitar under standard tuning?
In which Olympics was the men’s 100 meter sprint world record broken?	Which Olympics saw the male 100m sprint world record broken?	In which Olympics was the men’s 100 meter sprint world record broken by a time over 10 seconds?	In which Olympics was the men’s 100 meter sprint world record broken by a time of 10 seconds or less?
What countries have both deserts and glaciers?	In which sovereign states can one find both deserts and glaciers?	What countries have both deserts and glaciers and are contained entirely in the Southern Hemisphere?	What countries have both deserts and glaciers and are contained in whole or part in the Northern Hemisphere?
What island nations in the Caribbean were part of the Spanish Empire?	Which countries are in the Caribbean?	What island countries are located in the Caribbean?	What countries located in the Caribbean are not island countries?
In which universities do Nobel Prize Laureates work currently?	Which universities have Nobel laureates on their active staff?	Which universities have Nobel laureates in Economics on their active staff?	Which universities have Nobel laureates on their active staff excluding the Nobel Prize for Economics?
With which countries does India have ongoing border disputes?	Which countries currently have territorial disputes with India?	With which countries that are nuclear powers does India have ongoing border disputes?	With which countries that are not nuclear powers does India have ongoing border disputes?
What countries on the Arabian Peninsula are considered part of the Middle East?	Which countries are in the Middle East and on the Arabian Peninsula?	What countries on the Arabian Peninsula are part of the Middle East and have a population over five million?	What countries on the Arabian Peninsula are part of the Middle East and have a population of five million or less?
What rivers over 500 kilometers long flow into the Black Sea or the Sea of Azov?	Which rivers over 500 kms in length feed into the Black Sea or the Sea of Azov?	What rivers over 500 kilometers long flow into the Sea of Azov?	What rivers over 500 kilometers long flow into the Black Sea other than those that flow in via the Sea of Azov?
What political parties had at least one minister or deputy minister in the 67th Italian government (excluding independents)?	Which parties (excluding independents) have had ministers or deputy ministers in the 67th government of the Italian Republic?	What political parties had at least one minister or deputy minister in the 67th Italian government (excluding independents) and are part of the European Democratic Party?	What political parties had at least one minister or deputy minister in the 67th Italian government (excluding independents, if any) but are not part of the European Democratic Party?